{
  "$schema": "https://github.com/FunProgramer/vocabulary-trainer-app/raw/flutter-rewrite/schema/vocabulary-collection.schema.json",
  "title": "Unit 11 (Part 3)",
  "languageA": "en",
  "languageB": "de",
  "vocabularies": [
    {
      "languageA": "to re-shore",
      "languageARegex": "(to )?re-?shore",
      "languageB": "(Industrie) wieder im Inland ansiedeln, wieder ins Inland verlagern",
      "languageBRegex": "(\\(?Industrie\\)? )?(wieder im Inland ansiedeln|wieder ins Inland verlagern|wieder im Inland ansiedeln, wieder ins Inland verlagern)"
    },
    {
      "languageA": "head",
      "languageARegex": "head",
      "languageB": "Leiter/in, Chef/in",
      "languageBRegex": "(Leiter(/in)?|Chef(/in)?|Leiter/in, Chef/in)"
    }
  ]
}
